{
  "model_version": "0.1.0",
  "model_family": "inc15c6g-ogc-legal-services-and-authority-boundaries",
  "retained_original_source_receipt": "evidence/hhs-ogc-2026-statement/receipts/git-custody.json",
  "source_document_id": "2026-19903",
  "published_on": "2026-09-29",
  "separately_qualified_legal_effective_date": null,
  "previous_OGC_statements_rescinded_as_source_claim": true,
  "source_institution_ref": "INC15C3-HHS-LINK-OGC",
  "HHS_legal_first_level_denominator": null,
  "legal_services_client_edge_count": 23,
  "source_relationship_records": 39,
  "source_reported_exceptions_and_qualifiers_required": true,
  "OIG_exclusion_source_qualified": true,
  "OGC_legal_direction_over_OIG_certified": false,
  "FDA_administrative_position_not_professional_chain": true,
  "UACLRD_independent_child_representation_boundary": true,
  "satellites_not_separately_established_offices": true,
  "no_new_canonical_federal_institutions": 0,
  "role_and_program_authorities_referenced_but_not_independently_certified": true,
  "relationship_type_counts": {
    "publisher_described_legal_services_client": 23,
    "individual_child_legal_representation": 1,
    "case_scoped_OGC_complex_litigation_service": 1,
    "department_wide_professional_ethics_service": 1,
    "department_wide_legal_services_domain": 1,
    "express_statutory_jurisdiction_legal_counsel_carveout": 1,
    "FDA_ChiefCounsel_administrative_location_only": 1,
    "FDA_ChiefCounsel_professional_reporting": 1,
    "CMSD_professional_reporting_via_CLO": 1,
    "case_specific_adverse_client_representation_exclusion": 2,
    "internal_OGC_conflicted_legal_function_separation": 1,
    "duty_location_non_organizational_and_limited_site_administration": 1,
    "General_Counsel_direct_professional_reporting": 1,
    "binding_legal_advice_source_scope_with_external_citation": 1,
    "publisher_reports_secretarial_ethics_role_delegations": 1,
    "OGC_predecessor_statement_rescission_source_bound": 1
  },
  "items": [
    {
      "id": "INC15C6G-OGC-REL-01",
      "source_ogc_unit_id": "INC15C6G-OGC-ARPAH",
      "target_existing_HHS_index_id": "INC15C3-HHS-LINK-ARPA-H",
      "target_publisher_name": "Advanced Research Projects Agency for Health",
      "relationship_type": "publisher_described_legal_services_client",
      "source_section_locator": "III.B.1",
      "source_printed_page_locator": "61425",
      "source_qualified_scope": "OGC division supplies legal services to named client; not agency command",
      "external_instrument_citation": null,
      "externally_cited_instrument_independently_qualified": false,
      "source_document_id": "2026-19903",
      "source_publication_date": "2026-09-29",
      "source_legal_effective_date": null,
      "relationship_source_status": "official_OGC_statement_published_effective_date_unqualified",
      "signed_client_agency_command_transfer_verified": false,
      "ALJ_case_control_or_adjudicative_decision_power_verified": false,
      "independent_OIG_counsel_override_verified": false,
      "named_individual_power_assignment_verified": false,
      "current_whole_HHS_legal_first_level_count": null,
      "target_ogc_unit_id": null
    },
    {
      "id": "INC15C6G-OGC-REL-02",
      "source_ogc_unit_id": "INC15C6G-OGC-CMSD",
      "target_existing_HHS_index_id": "INC15C3-HHS-LINK-CMS",
      "target_publisher_name": "Centers for Medicare & Medicaid Services",
      "relationship_type": "publisher_described_legal_services_client",
      "source_section_locator": "III.B.2",
      "source_printed_page_locator": "61425",
      "source_qualified_scope": "Legal advice/representation for listed CMS/OMHA/DAB clients is not appellate decision or ALJ case authority",
      "external_instrument_citation": null,
      "externally_cited_instrument_independently_qualified": false,
      "source_document_id": "2026-19903",
      "source_publication_date": "2026-09-29",
      "source_legal_effective_date": null,
      "relationship_source_status": "official_OGC_statement_published_effective_date_unqualified",
      "signed_client_agency_command_transfer_verified": false,
      "ALJ_case_control_or_adjudicative_decision_power_verified": false,
      "independent_OIG_counsel_override_verified": false,
      "named_individual_power_assignment_verified": false,
      "current_whole_HHS_legal_first_level_count": null,
      "target_ogc_unit_id": null
    },
    {
      "id": "INC15C6G-OGC-REL-03",
      "source_ogc_unit_id": "INC15C6G-OGC-CMSD",
      "target_existing_HHS_index_id": "INC15C3-HHS-LINK-OMHA",
      "target_publisher_name": "Office of Medicare Hearings and Appeals",
      "relationship_type": "publisher_described_legal_services_client",
      "source_section_locator": "III.B.2",
      "source_printed_page_locator": "61425",
      "source_qualified_scope": "Legal advice/representation for listed CMS/OMHA/DAB clients is not appellate decision or ALJ case authority",
      "external_instrument_citation": null,
      "externally_cited_instrument_independently_qualified": false,
      "source_document_id": "2026-19903",
      "source_publication_date": "2026-09-29",
      "source_legal_effective_date": null,
      "relationship_source_status": "official_OGC_statement_published_effective_date_unqualified",
      "signed_client_agency_command_transfer_verified": false,
      "ALJ_case_control_or_adjudicative_decision_power_verified": false,
      "independent_OIG_counsel_override_verified": false,
      "named_individual_power_assignment_verified": false,
      "current_whole_HHS_legal_first_level_count": null,
      "target_ogc_unit_id": null
    },
    {
      "id": "INC15C6G-OGC-REL-04",
      "source_ogc_unit_id": "INC15C6G-OGC-CMSD",
      "target_existing_HHS_index_id": "INC15C3-HHS-LINK-DAB",
      "target_publisher_name": "Departmental Appeals Board",
      "relationship_type": "publisher_described_legal_services_client",
      "source_section_locator": "III.B.2",
      "source_printed_page_locator": "61425",
      "source_qualified_scope": "Legal advice/representation for listed CMS/OMHA/DAB clients is not appellate decision or ALJ case authority",
      "external_instrument_citation": null,
      "externally_cited_instrument_independently_qualified": false,
      "source_document_id": "2026-19903",
      "source_publication_date": "2026-09-29",
      "source_legal_effective_date": null,
      "relationship_source_status": "official_OGC_statement_published_effective_date_unqualified",
      "signed_client_agency_command_transfer_verified": false,
      "ALJ_case_control_or_adjudicative_decision_power_verified": false,
      "independent_OIG_counsel_override_verified": false,
      "named_individual_power_assignment_verified": false,
      "current_whole_HHS_legal_first_level_count": null,
      "target_ogc_unit_id": null
    },
    {
      "id": "INC15C6G-OGC-REL-05",
      "source_ogc_unit_id": "INC15C6G-OGC-CFAD",
      "target_existing_HHS_index_id": "INC15C3-HHS-LINK-ACF",
      "target_publisher_name": "Administration for Children and Families",
      "relationship_type": "publisher_described_legal_services_client",
      "source_section_locator": "III.B.3",
      "source_printed_page_locator": "61425",
      "source_qualified_scope": "OGC division supplies legal services to named client; not agency command",
      "external_instrument_citation": null,
      "externally_cited_instrument_independently_qualified": false,
      "source_document_id": "2026-19903",
      "source_publication_date": "2026-09-29",
      "source_legal_effective_date": null,
      "relationship_source_status": "official_OGC_statement_published_effective_date_unqualified",
      "signed_client_agency_command_transfer_verified": false,
      "ALJ_case_control_or_adjudicative_decision_power_verified": false,
      "independent_OIG_counsel_override_verified": false,
      "named_individual_power_assignment_verified": false,
      "current_whole_HHS_legal_first_level_count": null,
      "target_ogc_unit_id": null
    },
    {
      "id": "INC15C6G-OGC-REL-06",
      "source_ogc_unit_id": "INC15C6G-OGC-CFAD",
      "target_existing_HHS_index_id": null,
      "target_publisher_name": "Office of Refugee Resettlement (ACF)",
      "relationship_type": "publisher_described_legal_services_client",
      "source_section_locator": "III.B.3",
      "source_printed_page_locator": "61425",
      "source_qualified_scope": "OGC division supplies legal services to named client; not agency command",
      "external_instrument_citation": null,
      "externally_cited_instrument_independently_qualified": false,
      "source_document_id": "2026-19903",
      "source_publication_date": "2026-09-29",
      "source_legal_effective_date": null,
      "relationship_source_status": "official_OGC_statement_published_effective_date_unqualified",
      "signed_client_agency_command_transfer_verified": false,
      "ALJ_case_control_or_adjudicative_decision_power_verified": false,
      "independent_OIG_counsel_override_verified": false,
      "named_individual_power_assignment_verified": false,
      "current_whole_HHS_legal_first_level_count": null,
      "target_ogc_unit_id": null
    },
    {
      "id": "INC15C6G-OGC-REL-07",
      "source_ogc_unit_id": "INC15C6G-OGC-CFAD",
      "target_existing_HHS_index_id": "INC15C3-HHS-LINK-ACL",
      "target_publisher_name": "Administration for Community Living",
      "relationship_type": "publisher_described_legal_services_client",
      "source_section_locator": "III.B.3",
      "source_printed_page_locator": "61425",
      "source_qualified_scope": "OGC division supplies legal services to named client; not agency command",
      "external_instrument_citation": null,
      "externally_cited_instrument_independently_qualified": false,
      "source_document_id": "2026-19903",
      "source_publication_date": "2026-09-29",
      "source_legal_effective_date": null,